{
  "schema_version": "v1",
  "artifact_id": "conversation-acme-2026-08-15",
  "source": {
    "provider": "granola",
    "source_id": "not_123",
    "captured_at": "2026-08-15T17:10:00Z",
    "raw_reference": { "kind": "record", "value": "granola:note:not_123" }
  },
  "title": "Acme onboarding review",
  "started_at": "2026-08-15T16:00:00Z",
  "ended_at": "2026-08-15T16:30:00Z",
  "participants": [
    { "participant_id": "p1", "display_name": "Ari", "email": "ari@acme.example", "role": "customer" },
    { "participant_id": "p2", "display_name": "Founder", "role": "internal" }
  ],
  "summary_markdown": "Acme needs scheduled exports before expanding the rollout.",
  "transcript_segments": [
    {
      "segment_id": "segment-1",
      "speaker": { "participant_id": "p1", "display_name": "Ari" },
      "start_seconds": 312,
      "end_seconds": 321,
      "text": "We can expand once scheduled exports are available."
    }
  ],
  "identified_decisions": [
    { "item_id": "meeting-decision-1", "statement": "Evaluate scheduled exports this sprint.", "owner": "Founder", "evidence_refs": ["meeting-evidence-1"] }
  ],
  "action_items": [
    { "item_id": "meeting-action-1", "description": "Send Acme a feasibility update.", "owner": "Founder", "status": "open", "evidence_refs": ["meeting-evidence-1"] }
  ],
  "evidence": [
    {
      "evidence_id": "meeting-evidence-1",
      "locator": { "kind": "transcript-segment", "value": "segment-1" },
      "excerpt": "We can expand once scheduled exports are available."
    }
  ],
  "unknowns": ["Acme's expansion seat count is not in the meeting record."],
  "sensitivity": "confidential"
}
